{
  "schema_version": 1,
  "pair_id": "vs2-inputs",
  "round_id": "r3",
  "manifest_sha256": "4024e1ffad218bf10086a9bd0786be6a0b614b668302a5c2ca7e4b89d72dd39b",
  "semantic_tip": "520d50fd6f9c9349773230f248ed537409edaa77",
  "actor": {
    "client": "Codex desktop",
    "cli_version": "not exposed",
    "model": "GPT-6",
    "session": "vs2-inputs-2026-09-20"
  },
  "independence": "self-review",
  "mode": "full",
  "status": "complete",
  "orientation_done": true,
  "reviewed_commits": [
    "4c45515d8e44fa24ecc1a2d6c388a8d82b2b6772",
    "6e2cd574f667d34251078c8c0d2fb95c13256318",
    "4abbcdd20f0dfe339e53f8332d3b509b07753341",
    "068376980510d4e32004583efb11c6e2d0c9b2be",
    "520d50fd6f9c9349773230f248ed537409edaa77"
  ],
  "aggregate_done": true,
  "findings": [],
  "check_records": [
    "verification-summary.json",
    "review-notes.md",
    "../r2/review.json"
  ],
  "limitations": [
    "Documentation-only revision; exact-SHA prior evidence carried forward",
    "Author self-review; owner approval remains pending"
  ],
  "carry_forward_record": "changes.md",
  "platform_approval": false
}