{
  "schema_version": 1,
  "pair_id": "vs2-inputs",
  "round_id": "r1",
  "manifest_sha256": "d64ee5952693d8eb7f99a12fda153247bb7e03e812585d4970dbc46c3d539b9f",
  "semantic_tip": "4abbcdd20f0dfe339e53f8332d3b509b07753341",
  "actor": {
    "client": "Codex desktop",
    "cli_version": "not exposed",
    "model": "GPT-6",
    "session": "vs2-inputs-2026-09-20"
  },
  "independence": "self-review",
  "mode": "full",
  "status": "complete",
  "orientation_done": true,
  "reviewed_commits": [
    "4c45515d8e44fa24ecc1a2d6c388a8d82b2b6772",
    "6e2cd574f667d34251078c8c0d2fb95c13256318",
    "4abbcdd20f0dfe339e53f8332d3b509b07753341"
  ],
  "aggregate_done": true,
  "findings": [],
  "check_records": [
    "verification-summary.json",
    "review-notes.md"
  ],
  "limitations": [
    "Author self-review; owner acceptance pending",
    "Windows/Python3.12 only",
    "Synthetic input correctness; no empirical study or embedding preflight",
    "Curator attestation is a claim, not authentication"
  ],
  "carry_forward_record": null,
  "platform_approval": false
}